{
  "id": "MNT-010",
  "pattern": "P1",
  "title": "설비 건전성",
  "permission": { "view": "조회" },
  "badges": ["시연용", "가상 엔진"],
  "period": { "options": ["last30days", "thisMonth", "thisYear"], "default": "last30days" },
  "kpis": [
    { "metric": "oee.availability", "link": { "label": "손실 분석", "to": "OPS-020" } },
    { "metric": "mnt.mtbf" },
    { "metric": "mnt.mttr" },
    { "metric": "mnt.pmCompliance", "link": { "label": "정비 요청·처리", "to": "MNT-020" } },
    { "metric": "loss.downtimeCost", "link": { "label": "비가동 이력", "to": "OPS-050" } }
  ],
  "panels": [
    { "id": "health", "type": "healthTable", "title": "감시 설비 건전성", "area": "main-top", "grow": 1.4 },
    { "id": "orders", "type": "openOrders", "title": "진행 중인 정비", "area": "main-bottom", "link": { "label": "정비 요청·처리", "to": "MNT-020" } },
    { "id": "alerts", "type": "healthAlerts", "title": "AI 이상 징후", "area": "side", "grow": 2.4 },
    { "id": "collection", "type": "collection", "title": "데이터 수집 상태", "area": "side" }
  ]
}
