{
  "id": "MNT-020",
  "pattern": "P5",
  "title": "정비 요청·처리",
  "permission": { "view": "조회", "edit": "편집" },
  "badges": ["시연용"],
  "dataSource": "workOrders",
  "workflow": "workOrder",
  "filters": [
    { "field": "requestedAt", "label": "요청 기간", "control": "dateRange", "default": "last30days", "required": true },
    { "field": "type", "label": "유형", "control": "select", "options": ["예지", "예방", "사후"] },
    { "field": "lineId", "label": "라인", "control": "select", "options": "lines" },
    { "field": "title", "label": "검색", "control": "text", "placeholder": "오더 번호·설비·내용", "fields": ["id", "equipmentId", "title"] }
  ],
  "list": {
    "stageField": "stage",
    "stages": ["요청", "승인", "작업 중", "완료", "효과 확인"],
    "openStages": ["요청", "승인", "작업 중"],
    "columns": [
      { "field": "id", "label": "오더", "width": 150, "pinned": true },
      { "field": "stage", "label": "단계", "width": 90 },
      { "field": "type", "label": "유형", "width": 70 },
      { "field": "title", "label": "내용", "flex": 3 },
      { "field": "siteId", "label": "사업장", "ref": "sites", "width": 90, "showWhen": "company" },
      { "field": "lineId", "label": "라인", "ref": "lines", "flex": 1 },
      { "field": "requestedAt", "label": "요청", "format": "datetime", "width": 140 }
    ]
  },
  "content": { "title": "정비 오더" },
  "actions": ["조회", "신규", "저장", "승인", "반려", "완료", "확인", "내보내기"]
}
