{
  "id": "EXE-010",
  "pattern": "P1",
  "title": "경영 현황",
  "permission": { "view": "조회" },
  "badges": ["시연용"],
  "mobile": true,
  "period": { "options": ["today", "thisWeek", "thisMonth", "thisYear"], "default": "thisMonth" },
  "kpisFrom": "industry",
  "kpis": [
    { "metric": "plan.attainment" },
    { "metric": "oee", "link": { "label": "손실 분석", "to": "OPS-020" } },
    { "metric": "quality.ppmInternal", "link": { "label": "원인 분석", "to": "QUA-020" } },
    { "metric": "loss.downtimeCost", "link": { "label": "비가동 이력", "to": "OPS-050" } },
    { "metric": "ax.effect", "scope": "sinceGoLive", "link": { "label": "근거 보기", "to": "EXE-020" } }
  ],
  "panels": [
    { "id": "trend", "type": "monthlyTrend", "title": "월별 OEE · AX 적용 전후", "area": "main-top", "metric": "oee", "link": { "label": "AX 성과·ROI", "to": "EXE-020" } },
    { "id": "sites", "type": "siteTable", "title": "사업장 비교", "area": "main-bottom", "metrics": ["plan.attainment", "oee", "quality.ppmInternal", "loss.downtimeCost"] },
    { "id": "risks", "type": "risks", "title": "주요 리스크", "area": "side", "link": { "label": "알림 센터", "to": "COM-010" } }
  ]
}
